{
  "$schema": "http://json-schema.org/draft-07/schema#",
  "title": "Audit Log Entry",
  "type": "object",
  "additionalProperties": false,
  "required": [
    "audit_id",
    "run_id",
    "timestamp",
    "actor",
    "action",
    "target",
    "status"
  ],
  "properties": {
    "audit_id": { "type": "string", "minLength": 1 },
    "run_id": { "type": "string", "minLength": 1 },
    "timestamp": { "type": "string", "format": "date-time" },
    "actor": { "type": "string", "minLength": 1 },
    "action": { "type": "string", "minLength": 1 },
    "target": { "type": "string", "minLength": 1 },
    "status": { "type": "string", "enum": ["success", "failure"] },
    "metadata": {
      "type": "object",
      "additionalProperties": { "type": "string" }
    }
  }
}
